UnitCode,UnitName,Faculty,LocationAndTime,CreditPoints,EFTSL,Preqs,Proh,SCABand,Sypnosis
CHM3180,Materials chemistry,Faculty of Sciences,"[[['Clayton'], ['Second semester 2017 (Day)']]]",6,0.125,Six points of level one chemistry and six points of level two chemistry. Students without this should consult the third year coordinator.,CHM2180,2,"The unit describes the structure, properties and synthesis of biomaterials, macromolecules, and 'smart' inorganic materials, which are designed to carry out a range of sensing or active functions. Includes: biopolymers and biomineralisation in plants and animals; mimicry of biological systems; properties of everyday materials such as polypropylene and polyurethane and the link between their properties, structure and synthesis; properties of inorganic and metal-organic solids such as conductivity, magnetism, and porosity; theory and use of X-ray crystallography for determining solid-state structures. Principles of controlled radical polymerisation such as RAFT that is widely used in industry to synthesize polymers of certain molecular weights are introduced. In addition, ionic liquids as 'new generation' liquid materials are introduced. The unit also offers an opportunity to learn about a fast emerging field of alternative resources of energy such as solar cells, advanced batteries and fuel cells."
CHM3742,Chemistry of the environment 2,Faculty of Sciences,"[[['Gippsland'], ['Second semester 2017 (Day)']]]",6,0.125,CHM2752 or CHM2922,ENV3726,2,"In this unit, the fundamental principles and concepts of chemistry studied in previous years will be related to the aquatic and atmospheric systems. The chemical processes which occur in natural and modified systems will be examined with a particular view of understanding the nature, effects and fate of pollutants. This provides students with the background to understand current issues such as air and water pollution, the enhanced greenhouse effect and stratospheric ozone depletion. Some emphasis will be placed on the analysis of air and water, and water treatment processes will be investigated for both the production of potable water as well as treatment of polluted waters."
CHM3911,Advanced physical chemistry,Faculty of Sciences,"[[['Clayton'], ['First semester 2017 (Day)']]]",6,0.125,CHM2922. Students without this should consult the third year coordinator.,,2,"Physical chemistry provides insight into the fundamental reason that chemical systems and materials behave the way they do. This unit gives students an advanced understanding of the properties and characteristics of solids, liquids and gases from a fundamental level - utilising computation of individual atoms and bonds - right through to applied systems such as colloids and surfactants, relevant to minerals, food and formulation. The course follows a natural progression from atomic and molecular properties at a single atom or bond level through key thermodynamics to the properties of chemical systems, such as viscosity, phase behaviour and the interactions between solids and liquids. The final section deals with surfaces and colloids - key to understanding important chemical systems in Australian science and industry, due to their ubiquity in minerals processing, food and dairy industries, energy and oil, pharmaceuticals, water and waste processing."
CHM3922,Advanced organic chemistry,Faculty of Sciences,"[[['Clayton'], ['Second semester 2017 (Day)']], [['Malaysia'], ['Second semester 2017 (Day)']]]",6,0.125,CHM2911. Students without this should consult the third year coordinator.,,2,A description of the advanced tools and methodologies that are used in the determination of reaction mechanisms will be provided. This is supported by a discussion of the theoretical basis of the design of synthetic pathways for target e.g. bioactive molecules. The knowledge gained will be used to elucidate the reaction mechanisms of common organic reactions and metal-mediated reactions towards identifying scope in organic chemistry. The development of chemical methods that allow realisation of the concept of a sustainable future will also be discussed. Advanced NMR spectroscopy will also be introduced as a useful tool to elucidating structure.
CHM3930,Medicinal chemistry,Faculty of Sciences,"[[['Clayton'], ['First semester 2017 (Day)']], [['Malaysia'], ['First semester 2017 (Day)']]]",6,0.125,CHM2911 or CHM2942 or CHM2762.  Students who have not completed and passed one of these units should consult the third year coordinator.,,2,"This unit focuses on several major classes of biologically and clinically important therapeutic agents. Students will study the traditional use, isolation, structural characterisation, synthesis and clinical evaluation of drugs and also be exposed to newer crystallographic, computational, combinatorial and screening methodology used in drug design and development. The subject will consist of three inter-related sections: drug discovery and development, molecular recognition, and chemistry and the synthesis of biological polymers. Where appropriate, guest speakers from industry and government agencies will contribute to the subject."
CHM3941,Advanced inorganic chemistry,Faculty of Sciences,"[[['Clayton'], ['First semester 2017 (Day)']]]",6,0.125,CHM2911. Students without this should consult the third year coordinator.,,2,"A general description of the synthetic methods and characterization techniques that are used to prepare coordination complexes and organometallic compounds will be provided together with the tools and methodologies used in the determination of reaction mechanisms and, in particular, metal centred/mediated reactions. Techniques commonly used to study the structure and properties of inorganic complexes will be introduced through the practical classes and a problem based approach."
CHM3952,Advanced analytical chemistry,Faculty of Sciences,"[[['Clayton'], ['Second semester 2017 (Day)']]]",6,0.125,CHM2922. Students without this should consult the third year coordinator.,,2,"Advances in analytical science will involve the development and exploitation of advanced mass spectrometric, molecular spectroscopic and separation techniques. This unit concentrates on these approaches, and provides examples of how they can be applied in areas such as forensic and environmental science, genomics and forensic imaging.  The remainder of the unit covers the use of spectroscopic, radiometric, separation and particle characterization techniques in automated monitoring and process analysis in a variety of industrial, clinical and environmental applications. Aspects of instrumentation, data processing and chemometrics will be emphasised in each analytical technique discussed."
CHM3960,Environmental chemistry,Faculty of Sciences,"[[['Clayton'], ['First semester 2017 (Day)']], [['Malaysia'], ['Second semester 2017 (Day)']]]",6,0.125,6 points of level one chemistry and 6 points of level two chemistry.  Students without this should consult the third year coordinator.,,2,"The three major components of the environment, air, soil and water, are considered. Environmental issues related to energy are outlined. Soils: natural, constituents, properties; chemical processes; organic matter; fertility; acidity; salinity; remediation. Water: major components; nutrient pollution including consequences and tracing methods; water treatment including sewage treatment, drinking water treatment and artificial wetlands. Air and energy: importance to society; fossil fuel use; combating atmospheric problems associated with fossil fuel use; alternative fuels, including biofuels; CO2 emissions reduction, carbon capture and sequestration."
CHM3972,Sustainable chemistry,Faculty of Sciences,"[[['Clayton'], ['Second semester 2017 (Day)']]]",6,0.125,Six points of level one chemistry and six points of level two chemistry. Students without this should consult the level three co-ordinator.,,2,"The development of chemical tools that allow realisation of the concept of a sustainable future - meeting the needs of the present without compromising the ability of future generations to meet their own needs - is the basis for the course of sustainable chemistry.  This will be dealt with in three interconnected streams: Introduction to green chemistry, Sustainable technologies and Green energy technologies."
CHM3980,Chemistry study abroad,Faculty of Sciences,"[[['Clayton'], ['First semester 2017 (Day)', 'Second semester 2017 (Day)', 'Summer semester A (starts November) 2017 (Day)']]]",6,0.125,Students must have achieved a 65 average over three level-two or level-three chemistry units or; special permission from the unit coordinator.,,2,"This unit provides students with the opportunity to carry out a research project overseas as part of their final year of study in chemistry. The project may be carried out within a university or industry research laboratory by arrangement and approval of the Head of School. Allied with the practical work will be online tutorial materials and support on formal matters relating to OH&S, database searching, data analysis and presentation and report presentation."
CHM3990,Chemistry project,Faculty of Sciences,"[[['Clayton'], ['First semester 2017 (Day)', 'Second semester 2017 (Day)']]]",6,0.125, Students must have achieved a 65 average over three level-twoor level-three chemistry units or; special permission from the unit coordinator.,,2,"This course allows students to devote themselves to a substantial laboratory project as part of their final year of study in Chemistry. The project may be carried out within the School of Chemistry teaching and research laboratories or in an industrial laboratory by arrangement and approval of the Head of School. Allied with the practical work will be tutorial materials and discussion on formal matters relating to OH&S, database searching, data analysis and presentation and report presentation."
CHM4100,Chemistry research project,Faculty of Sciences,"[[['Clayton'], ['Full year 2017 (Day)', 'Second semester 2017 to First semester 2018 (Day)']]]",36,0.750,Completion of a Chemistry major and 24 points of CHM3XXX units,,2,Students undertake a supervised research project in a specialised area of chemistry. Candidates may commence the honours year at the beginning of either first or second semester. Further information is available from the course coordinator and at a meeting held with prospective students during second semester of third year.
CHM4110,Chemistry research project part time I,Faculty of Sciences,"[[['Clayton'], ['Full year 2017 (Day)', 'Second semester 2017 to First semester 2018 (Day)']]]",18,0.375,,,2,Students undertake a supervised research project in a specialised area of chemistry. Candidates may commence the honours year at the beginning of either first or second semester. Further information is available from the course coordinator and at a meeting held with prospective students during second semester of third year.
CHM4120,Chemistry research project part time II,Faculty of Sciences,"[[['Clayton'], ['Full year 2017 (Day)', 'Second semester 2017 to First semester 2018 (Day)']]]",18,0.375,,,2,Students undertake a supervised research project in a specialised area of chemistry. Candidates may commence the honours year at the beginning of either first or second semester. Further information is available from the course coordinator and at a meeting held with prospective students during second semester of third year.
CHM4180,Medicinal chemistry research project,Faculty of Sciences,"[[['Malaysia'], ['Full year 2017 (Day)', 'Second semester 2017 to First semester 2018 (Day)']]]",36,0.750,Completion of the admission requirements for the Bachelor of Science (Honours),,2,Students will undertake a supervised research project. Candidates may commence the honours year at the beginning of either the first or second semester. Students will carry out a research project and present the results of their study in both written and oral form. Information about research projects will be available from the course coordinator towards the end of the preceding semester.
CHM4201,Chemistry honours coursework,Faculty of Sciences,"[[['Clayton'], ['First semester 2017 (Day)']]]",12,0.250,,,2,"All students will undertake a Professional Studies topic and one core topic defined by the School, as well as three elective topics from specialised areas of chemistry, such as pericyclic reactions, separation science, advanced organic synthesis, main group inorganic chemistry, supramolecular chemistry, computational chemistry and electron microscopy. Each topic will require students to attend 8 lecture equivalents making a total of 48 lecture equivalents for the unit. Further information is available from the course coordinator and at a meeting held with prospective students during second semester of third year."
CHM4211,Chemistry honours coursework part time I,Faculty of Sciences,"[[['Clayton'], ['First semester 2017 (Day)']]]",6,0.125,,,2,"All students will undertake a Professional Studies topic and one core topic defined by the School, as well as three elective topics from specialised areas of chemistry, such as pericyclic reactions, separation science, advanced organic synthesis, main group inorganic chemistry, supramolecular chemistry, computational chemistry and electron microscopy. Each topic will require students to attend 8 lecture equivalents making a total of 48 lecture equivalents for the unit. Further information is available from the course coordinator and at a meeting held with prospective students during second semester of third year."
CHM4221,Chemistry honours coursework part time II,Faculty of Sciences,"[[['Clayton'], ['First semester 2017 (Day)']]]",6,0.125,,,2,"All students will undertake a Professional Studies topic and one core topic defined by the School, as well as three elective topics from specialised areas of chemistry, such as pericyclic reactions, separation science, advanced organic synthesis, main group inorganic chemistry, supramolecular chemistry, computational chemistry and electron microscopy. Each topic will require students to attend 8 lecture equivalents making a total of 48 lecture equivalents for the unit. Further information is available from the course coordinator and at a meeting held with prospective students during second semester of third year."
CHM4280,Honours coursework in medicinal chemistry,Faculty of Sciences,"[[['Malaysia'], ['Full year 2017 (Day)', 'Second semester 2017 to First semester 2018 (Day)']]]",12,0.250,Completion of the admission requirements for the Bachelor of Biotechnology Honours year or for the Science (Honours),,2,"This unit provides advanced instruction in quantitative methods, thesis writing and current topics to students enrolled in the honours program in medicinal chemistry. Students will gain an understanding of advanced experimental design, data analysis and scientific writing that will assist them in completing their honours thesis. Further classes and coursework relating to current topics in medicinal chemistry will assist students in critical analysis of journal articles, providing further support for their academic development in research science."
DEV2011,Early human development from cells to tissues,Faculty of Sciences,"[[['Clayton'], ['First semester 2017 (Day)']]]",6,0.125,"One of BIO1011, BIO1022, BMS1021 or equivalent",,2,"Introduces the structure and function of eukaryotic cells including the diversity of cell structure and function. The concept that the many specialized cell types in the adult human body are derived from a single fertilized egg is emphasized, laying the foundations for future studies of stem cells and embryogenesis. The four primary tissues (epithelium, connective tissue, muscle tissue, nervous tissue) are described and students learn how these tissues develop in the growing embryo. Topics covered include early human development, gametogenesis, fertilization, blastocyst formation and implantation, formation of stem cell lineages, germ layers and early derivatives."
DEV2022,Human anatomy and development: Tissues and body systems,Faculty of Sciences,"[[['Clayton'], ['Second semester 2017 (Day)']]]",6,0.125,DEV2011 or equivalent. (Students in course 3543 Bachelor of Biotechnology are exempt from this rule.),,2,"This unit provides students with basic knowledge of the structure of the human body. It describes how tissues are combined to form organs, and how organs and organ systems are organized to form adult body structure. The microscopic and macroscopic structure of the human body and some major body systems are covered. The general body plan is described and how the body plan is established during embryogenesis is discussed."
DEV3011,Fundamentals of developmental processes,Faculty of Sciences,"[[['Clayton'], ['First semester 2017 (Day)']]]",6,0.125,"DEV2011 and DEV2022; or BMS1062, BMS2011, BMS2021 and BMS2031. (Note that students in course 3543 Bachelor of Biotechnology are exempt from this rule and only need to have passed DEV2022 to enrol.)",,2,"This unit begins with an introduction to the concepts and experimental systems in developmental biology. How gene expression is regulated during development and thereby leads to the development of differentiated cells and tissues is considered. Communication between cells during development is described, as well as the key concepts of induction and competence. Some of the key early developmental processes and experimental strategies for studying developmental biology are covered. Finally, patterning and development of the body plan are described."
DEV3022,Developmental and anatomical basis of human health and disease,Faculty of Sciences,"[[['Clayton'], ['Second semester 2017 (Day)']]]",6,0.125,DEV3011,,2,"This unit considers the anatomy and development of the major organs and organ systems of the body. The classical morphogenetic steps/stages in organ development are described, as well as the most up to date knowledge of the molecular/genetic and foetal/maternal environmental regulation of these morphogenetic processes.  Organ systems covered include musculoskeletal, cardiovascular, central nervous, respiratory, gastrointestinal, renal and reproductive. Students will learn how abnormalities in genetic and/or environmental regulation of development lead to birth defects as well as chronic diseases in adulthood."
DEV3032,Stem cells and the foundations of life,Faculty of Sciences,"[[['Clayton'], ['Second semester 2017 (Day)']]]",6,0.125,"DEV2011 and DEV2022, or BMS1062, BMS2011, BMS2021 and BMS2031. (Note that students in course 3543 Bachelor of Biotechnology are exempt from this rule and only need to have passed DEV2022 to enrol.)",,2,"This unit begins with an introduction to embryonic stem cell biology and pluripotency. This will be followed by the characteristics and basic biology of newborn and adult stem cells. Subsequently inducible pluripotent stem cells will be introduced. The characteristics, anatomical location and clinical relevance of stem cells in specific tissues are then described, including haematopoiesis, kidney, gut, prostate, limb regeneration and immune, nervous and reproductive systems / mechanisms of fertility and infertility. Students also conduct a research project in stem cells and developmental biology. Two moderated classroom discussions on commercialisation, recent technological advances, and/or regulatory and ethical issues of stem cell research and clinical treatments are also included."
DEV3990,Action in developmental biology research project,Faculty of Sciences,"[[['Clayton'], ['First semester 2017 (Day)', 'Second semester 2017 (Day)', 'Summer semester A (starts November) 2017 (Day)']]]",6,0.125,12 points of study in the discipline area at 2nd year level and a grade point average of at least 70 over 24 points in the discipline area at 2nd year level and by permission of the Unit Convenor or the Head of Department.,,2,"This unit provides the opportunity for high achieving students to work with an academic supervisor and complete a research project in Developmental Biology. The research project may be chosen from a list of projects available at the beginning of semester from the Department of Anatomy & Developmental Biology. Students will work in a research laboratory to obtain data, will complete a final report and will give a series of oral presentations on their work. Students will also undertake an informal written open-book exam comprising 3 brief essays based on weekly tutorials."
EAE1011,"Earth, atmosphere and environment 1",Faculty of Sciences,"[[['Clayton'], ['First semester 2017 (Day)']]]",6,0.125,,"ENV1011, ESC1011",2," This unit is a core unit for further studies in Geology, Atmospheric Science, Climate Studies, Earth Science, Environmental Earth Science and Geographical Science.The Earth is a constantly changing complex system involving many physical, chemical, and biological processes. This unit is an introduction to the science used to understand the Earth system, how it changes over time, and its future. We will look at the Earth's place in the Universe and Solar System, the formation and structure of the Earth, and its changing environment. Fieldwork, practical exercises, simple models, and state of the art satellite data will be used to read the planet's history, and model and predict its future. We will also study the processes that drive change within our planet and its environmental systems: from the formation of the Earth's core to its crust; to the systems driving and sustaining the planet's living surface; to the forces and processes involved in the formation of mountains and oceans; and our changing atmosphere and climate."
EAE1022,"Earth, atmosphere and environment 2",Faculty of Sciences,"[[['Clayton'], ['Second semester 2017 (Day)']]]",6,0.125,,"ATS1301, ENV1022, ESC1022",2," This unit is a core unit for further studies in Geology, Atmospheric science, Climate studies, Earth science, Environmental earth science and Geographical science.We live on a constantly changing planet. This unit looks at the forces and processes that have shaped the planet over time, and the fossils and other biological, chemical and physical factors that provide evidence that these changes. Earthquakes, volcanoes, tsunamis, tornadoes, cyclones and other high impact events shape the very nature of life on Earth. We look at the science that we use to understand and model these hazards, and our attempts to predict and minimize the adverse effects of these processes and events. We will study the natural resources that are required to maintain our society - minerals, energy, water, soils and food - their origin, use, and limits, and sustainable management. At the completion of this unit, students will have a clear understanding of society's impact on the biosphere, hydrosphere, lithosphere and atmosphere."
EAE2011,Environmental problem solving and visualisation,Faculty of Sciences,"[[['Clayton'], ['First semester 2017 (Day)']]]",6,0.125,"One of ESC1011, ESC1022, ATS1301, EAE1011 or EAE1022",,2," Environmental problem solving and visualisation will provide thestudents with the ability to solve a wide-ranging set of commonproblems in environmental and climate science. Through practicalproblem solving it will introduce methods and techniques used inenvironmental and climate science to collect and analyse data, to buildquantitative models and to visualise key results. The unit will discuss anumber of environmental and climate science problem-based topicsinvolving observing and modelling the earth. Simple techniques andmethods from the fields of mathematics, physics and informationtechnology will be introduced successively in the context of real-worldproblems and will enable students to apply these necessary skills inthe higher level units in the Environmental Earth Sciences and ClimateScience majors."
EAE2111,Introduction to climate science,Faculty of Sciences,"[[['Clayton'], ['First semester 2017 (Day)']]]",6,0.125,"One of EAE1022, ESC1011, ESC1022, ATS1301",ATS2776 and ATS2779,2," From the humid tropics to the polar deserts, Earth's diversearray of climates are the result of complex physical, chemicaland biological processes and their interactions. This unitprovides an introduction to the Earth's climate system and itsoperation. Students will gain an appreciation of the climate ofthe Earth's surface, sub-surface and upper atmosphere, andhow these vary in space and time. Key processes that regulatethe climate on the global, regional and micro-scale will beintroduced. The natural operation of these processes, and theiroperation with human influence, will be examined. Students willbe exposed to the techniques and instrumentation used tomeasure and monitor the atmosphere and the real-worldapplications for climate monitoring will be described. Practicalexperience in meteorological measurement will be gainedthrough laboratory classes and a weekend field trip."
EAE2122,Introduction to atmospheric physics and dynamics,Faculty of Sciences,"[[['Clayton'], ['Second semester 2017 (Day)']]]",6,0.125,"One of EAE2011 or MTH1030, MTH1035 OR ENG1005",ATM2030,2," This unit examines atmospheric thermodynamics and dynamics,including cloud processes, the dynamics and prediction of severestorms (including tornadoes and tropical cyclones), the structure andevolution of extra-tropical cyclones and their associated fronts, and thetechniques used in forecasting the day-to-day weather."
