UnitCode,UnitName,Faculty,LocationAndTime,CreditPoints,EFTSL,Preqs,Proh,SCABand,Sypnosis
ANT1800,Introduction to anatomy and medical terminology,Faculty of Sciences,"[[['Malaysia'], ['Second semester 2017 (Day)']]]",6,0.125,, ANT2331Note that students who commenced the BSc(MedBioSci) prior to 2015 are supposed to take ANT2331 and will need to obtain approval for the ADE to substitute ANT1800 for ANT2331.,2,"This unit covers human anatomy in its broadest sense; to explore and understand structure and function at the macroscopic, microscopic (histological) and developmental (embryological) levels. Topographic studies will cover the morphology and organisation of the musculoskeletal system, the cardiovascular system, the respiratory system, the digestive system, urinary system, endocrine system, nervous system and reproductive system. Histology studies will correlate microscopic structure with function; beginning with the cell, moving on to the four primary tissue types and following up with systems-based histology where relevant. Embryology will help in understanding human development; beginning with fertilization and following up through the development of organ-body systems, with emphasis on mechanisms regulating normal development and organisation of the body. The unit encompasses familiarisation and usage of anatomical and medical terminology. Skills in practical observation, identification and communication will be encouraged as well as the ability to source for information through effective use of IT."
ASP1010,Earth to cosmos - introductory astronomy,Faculty of Sciences,"[[['Clayton'], ['First semester 2017 (Day)']]]",6,0.125,No formal background in astronomy or astrophysics is required.,ASP1010 can only be completed prior to ASP2011 and ASP2062,2,"This unit focuses on concepts that will allow students to gain understanding of key astrophysical phenomena. The topics covered include the night sky, the historical development of astronomical knowledge, our solar system, comets and asteroids, the sun, exoplanets, other stars, stellar remnants such as black holes, the Milky Way, other galaxies, quasars, dark matter, and cosmology in general."
ASP1022,Life in the universe - astrobiology,Faculty of Sciences,"[[['Clayton'], ['Second semester 2017 (Day)']]]",6,0.125,No formal background in astronomy or astrophysics is required.,,2,"This unit focuses on understanding astronomical, geological, chemical, biological and technological conditions necessary for primitive and intelligent life. The topics covered include: stellar and planetary formation, dynamics of planetary orbits, detection and properties of extrasolar planets, habitability, chemical and biological characteristics of life, how life first appeared on the Earth and how life depends on energy from the stars, probabilities of life forming on other planets, artificial life and artificial intelligence, interstellar travel and colonisation, the fate of the Universe and the implications for any life present."
ASP2011,Astronomy,Faculty of Sciences,"[[['Clayton'], ['First semester 2017 (Day)']]]",6,0.125,"One unit (six points) of physics at first-year level, and MTH1020 or MTH1030 or MTH1035 or ENG1005 or equivalent",,2,"An introduction to modern astronomy, with an emphasis on using astronomical observations to understand the evolution of stars, galaxies and the Universe. Students are introduced to the night sky and how to navigate around it using astronomical coordinates. The design, performance and use of visible and radio wavelength telescopes is discussed in detail, including imaging and spectroscopy. Visible and radio wavelength observations will be interpreted to determine the distances, masses, ages and evolution of stars and galaxies. Practical work in workshops is a key component of this unit, including an astronomical observing session and analysis of data from major observatories."
ASP2062,Introduction to astrophysics,Faculty of Sciences,"[[['Clayton'], ['Second semester 2017 (Day)']]]",6,0.125,"One unit (six points) of physics at first-year level, and MTH1030 or MTH1035 or ENG1005 or equivalent",,2,"An introduction to contemporary astrophysics, with a focus on the range of physical processes which shape the universe and the objects within. Students will study the generation, propagation and absorption of radiation; processes of star and planet formation; celestial mechanics; accretion disks; the sun; interiors of stars and nucleosynthesis; post main sequence evolution; degeneration remnants; the Milky Way; the structure of galaxies; active galaxies; particles and cosmic rays.  Laboratory work will include analytic and computer-based exercises, involving research-grade data and numerical codes."
ASP3012,Stars and galaxies,Faculty of Sciences,"[[['Clayton'], ['Second semester 2017 (Day)']]]",6,0.125,"One of MTH2010 or MTH2015, plus MTH2032, or ENG2005 and MTH2040",,2,Stellar photometry; observing the stars; star formation; equation of state; reduced equations of stellar structure; polytropic stellar models; full equations of stellar structure; the main sequence; post-main-sequence evolution. Galactic morphology and stellar content; elliptical and spiral galaxies; large-scale structure of the Milky Way; dark matter; potential theory; galactic dynamics-orbits in spherical and axisymmetric potentials. Astronomical data reduction.
ASP3051,Relativity and cosmology,Faculty of Sciences,"[[['Clayton'], ['First semester 2017 (Day)']]]",6,0.125," One of MTH2010,MTH2015 or ENG2005Recommended units: MTH2032 or MTH2040",,2,"Newtonian physics and Einstein's Special Theory of Relativity, the geometry of space-time, the Minkowski metric, Lorentz transformations, k-calculus, and four-vectors; the physics of space-time, momentum and energy; classical paradoxes; other metrics, Black Holes; observation of the Universe relevant to Cosmology; the expansion of the Universe, the Cosmic Background Radiation; the evolution of the Universe, propagation of light; primordial elements and recent observations."
ASP3162,Computational astrophysics and the extreme universe,Faculty of Sciences,"[[['Clayton'], ['Second semester 2017 (Day)']]]",6,0.125, ASP2062 and one of MTH2010 or MTH2015 orENG2005 and one of MTH2032 or MTH2040.,,2," In this unit students will learn the basic principles of astrophysical fluid dynamics and how it can be used to model the most extreme events in the universe. The unit covers the basic equations of compressible hydrodynamics, including the behaviour of linear waves, the transition to shocks and the behaviour of fluids at high Mach number. Students will apply this to understand the physical processes that power accreting sources including white dwarfs, neutron stars and black holes, and the physics behind the explosion of stars as supernovae. Students will gain practical experience in computational fluid dynamics including basic programming skills and an understanding of how large scale astrophysical simulations are performed.Students will also learn about high-energy observational techniques of supernova remnants and compact objects and statistical approaches for inference-based interpretation of high-energy observational data."
ASP3231,Observational astronomy,Faculty of Sciences,"[[['Clayton'], ['First semester 2017 (Day)']]]",6,0.125,"One of ASP2011, PHS2011, PHS2022, PHS2061, PHS2062 or PHS2081.",,2,"This unit gives students theoretical background and practical experience in modern observational astronomy. ASP3231 students study telescope optics, spectroscopy, CCD imaging, image processing, statistics, astronomical distances, stellar evolution, extra-solar planets, neutron stars and galaxies. An observational project, including an astronomical observing session and analysis of the observations, comprises a substantial component of ASP3231."
ASP4100,Astrophysics honours research project,Faculty of Sciences,"[[['Clayton'], ['Full year 2017 (Day)', 'Second semester 2017 to First semester 2018 (Day)']]]",24,0.500,Admission to honours in the discipline of Astrophysics,ASP4110 and ASP4120,2,Students are required to complete a research project involving original work on a topic chosen in consultation with their academic supervisor.
ASP4110,Astrophysics honours research project - Part 1,Faculty of Sciences,"[[['Clayton'], ['Full year 2017 (Day)', 'Second semester 2017 to First semester 2018 (Day)']]]",12,0.250,Admission to Honours in the discipline of Astrophysics,ASP4100,2," ASP4110 and ASP4120 together, are equivalent to ASP4100 but they enable students to study part time by allowing completion of the work over a longer time period.Students are required to complete the first part of a research project involving original work on a topic chosen in consultation with their academic supervisor."
ASP4120,Astrophysics honours research project - Part 2,Faculty of Sciences,"[[['Clayton'], ['Full year 2017 (Day)', 'Second semester 2017 to First semester 2018 (Day)']]]",12,0.250,ASP4110,ASP4100,2," ASP4110 and ASP4120 together, are equivalent to ASP4100 but they enable students to study part time by allowing completion of the work over a longer time period.Students are required to complete the first part of a research project involving original work on a topic chosen in consultation with their academic supervisor."
ASP4200,Astrophysics honours coursework,Faculty of Sciences,"[[['Clayton'], ['Full year 2017 (Day)', 'Second semester 2017 to First semester 2018 (Day)']]]",24,0.500,Admission to honours in the discipline of Astrophysics,ASP4210 and ASP4220,2,"ASP4200 is a level four unit in the Honours Program of the Bachelor of Science course. The unit comprises six approved lecture topics which students can choose from those offered in the Honours Handbook of the School of Mathematical Sciences. These provide advanced instruction in Astrophysics and related fields, and support for students wishing to develop a career in research."
ASP4210,Astrophysics honours coursework part 1,Faculty of Sciences,"[[['Clayton'], ['Full year 2017 (Day)', 'Second semester 2017 to First semester 2018 (Day)']]]",12,0.250,Admission to Honours in the discipline of Astrophysics,ASP4200,2," ASP4210 and ASP4220 together, are equivalent to ASP4200 but they enable students to study part time by allowing completion of the work over a longer time period.Students are required to select three sub-units (covering advanced coursework topics) from offerings within the School of Physics and Astronomy. These sub-units are to be selected in consultation with the student's academic supervisor. Some subunits may be chosen from outside the School - with permission from the honours coordinator.Students will also complete a literature review related to the research project component of their honours course."
ASP4220,Astrophysics honours coursework part 2,Faculty of Sciences,"[[['Clayton'], ['Full year 2017 (Day)', 'Second semester 2017 to First semester 2018 (Day)']]]",12,0.250,ASP4210,ASP4200,2," ASP4210 and ASP4220 together, are equivalent to ASP4200 butthey enable students to study part time by allowing completion of the work over a longer time period.Students are required to select three sub-units (covering advanced coursework topics) from offerings within the School ofPhysics and Astronomy. These sub-units are to be selected in consultation with the student's academic supervisor. Some subunitsmay be chosen from outside the School - with permission from the honours coordinator.Students will also complete a literature review related to the research project component of their honours course."
ATM3040,Physical meteorology,Faculty of Sciences,"[[['Clayton'], ['First semester 2017 (Day)']]]",6,0.125,ATM2030,ATM3010,2,"Physical meteorology examines the major physical forces that affect the behaviour of the atmosphere, specifically radiative transfer and precipitation. The radiative transfer section focuses on the scattering, absorption and emission of radiant energy within the atmosphere and how this knowledge is exploited by remote satellite and ground-based instrumentation. The cloud microphysics section focuses on the development of precipitation, as well as the interaction between clouds and aerosols."
ATM3050,Dynamical meteorology,Faculty of Sciences,"[[['Clayton'], ['Second semester 2017 (Day)']]]",6,0.125,MTH2010 or MTH2015. Recommended: ATM2020 and ATM2030.,,2,"The motion of a density-stratified fluid in a rotating frame of reference; important parameters and their magnitudes; 'homogeneous flows' in the atmosphere and ocean; shallow-water and Rossby-wave motion; western boundary currents; gradient-wind balance and vortex motion; dynamics of stratified fluids, including stability, blocking, internal gravity waves and thermal-wind balance."
BCH2011,Structure and function of cellular biomolecules,Faculty of Sciences,"[[['Clayton'], ['First semester 2017 (Day)']]]",6,0.125,12 points of level one chemistry or level one biology; OR BMS1011; OR CHE2165 and CHM2735. Recommended: VCE Chemistry if Chemistry is not taken at University.,BTH2741,2,"This unit focuses on the action of major classes of biomolecules in biologically and medically relevant systems. Protein structure is  related to function in contexts such as blood cells and extracellular matrix. The folding of proteins and the consequences of misfolding, as a cause of disease, are also explored. The mechanism of action of enzymes in medically important systems is examined. Carbohydrates and lipids are examined in the context of their function in diverse cellular compartments and biological membranes, respectively. The techniques used to isolate and study proteins, including their analysis using the tools provided by the new science of bioinformatics, are explored."
BCH2022,Metabolic basis of human diseases,Faculty of Sciences,"[[['Clayton'], ['Second semester 2017 (Day)']]]",6,0.125,BMS1011 or BCH2011,"BTH2757, BMS2021",2,"A general outline of cellular metabolism is provided. The material presented will illustrate normal metabolic pathways and their dysfunction in various human diseases and conditions including diabetes, alcoholism, starvation, glycogen storage diseases and juvenile developmental problems. The biochemical basis of hormonal regulation and nutrition, in both famine and disease, is presented."
BCH3021,Cellular organisation: Organelle structure and function in health and disease,Faculty of Sciences,"[[['Clayton'], ['First semester 2017 (Day)']]]",6,0.125,"One of BCH2011, BCH2022, BMS2021, MOL2011 or MOL2022 or MCB2011 OR MCB2022",BTH3741,2,"This unit provides an advanced understanding of the structure-function of the individual structural organelles and components of the cell in the context of cell biology and disease processes. Topics include the cytoskeleton, the formation of the membranes, the intra-cellular trafficking of proteins, the cellular internalization/export of proteins. Over-riding themes of this subject are: to view the cell as a dynamic unit composed of a series of interacting organelles to understand the cell as a semi-independent biological entity in constant contact and communication with the extracellular environment and with other cells in multi-cellular organisms."
BCH3031,Functional genomics and molecular medicine,Faculty of Sciences,"[[['Clayton'], ['First semester 2017 (Day)']]]",6,0.125,"One of the following BCH2011, BCH2022, BMS2062, MOL2011, MOL2022, MCB2011, MCB2022",BTH3752,2,"This unit provides an understanding of DNA as the genetic component of organisms and cells, encompassing the information content, the organisation of DNA sequences, and the expression of this information into RNA and proteins. Topics include global aspects of genome organisation and expression outcomes (genomics and proteomics, respectively). Other themes include the molecular diagnosis and treatment of human genetic disease using emerging technologies such as genome mining and novel gene therapy strategies."
BCH3042,Cell signal transduction: Role in cancer and human disease,Faculty of Sciences,"[[['Clayton'], ['Second semester 2017 (Day)']]]",6,0.125,"One of BCH2011, BCH2022, MOL2011, MOL2022, MCB2011, MCB2022; or BMS2021 or BMS2042",BTH3741,2,"This unit provides an advanced understanding of the molecular aspects of cell proliferation, cell signalling, differentiation and cell death as they relate to cell biology and medicine, in particular cancer. Themes include basic mechanisms of cell signalling involving cell receptors, gene expression, hormones and endocrine networks, and intracellular signalling cascade. These concepts are applied to cell growth, differentiation and cell death and how the involvement of the immune system is regulated in diseases, including auto-immune diseases, cancer (and its treatment) and the destruction of T-cells after human immunodeficiency virus (HIV) infection."
BCH3052,Protein biology: From sequence to structure and disease,Faculty of Sciences,"[[['Clayton'], ['Second semester 2017 (Day)']]]",6,0.125,"One of BCH2011, BCH2022, MOL2011, MOL2022, MCB2011, MCB2022 or BMS2021 or BMS2062",,2,"The course will give students an advanced understanding of protein structure-function in the context of human disease. Major themes relate the various levels of protein structure to their wide ranging functions, introduce modern techniques used in the analysis of structure and function, and explore the rapidly developing area of protein-related biotechnologies and drug design. Topics to be covered include examples of aberrations in protein structure that lead to alteration in function in a variety of biological contexts, emphasizing disease.  Additionally the use of bioinformatics in aiding our understanding of protein sequence, structure and function will be highlighted."
BCH3990,Action in biochemistry research project,Faculty of Sciences,"[[['Clayton'], ['First semester 2017 (Day)', 'Second semester 2017 (Day)']]]",6,0.125,"Permission from the Unit Coordinator. Students must have completed all first and second level units in their approved major, and be able to demonstrate that they have an appropriate project and supervisor(s). 12 points of study in the discipline area at 2nd year level and a grade point average of at least 70 over 24 points in relevant units at 2nd year level.",,2,"This unit provides the opportunity for high achieving students to work with an academic supervisor and complete a research project in Biochemistry.  The research project may be chosen from a list of projects available at the beginning of semester from the Department of Biochemistry.  The unit convenor and supervisor must approve the project topic at the time of enrolment. Student will work in a research laboratory to obtain data, will complete a written preliminary and final report and will give a series of oral presentations on their work."
BIO1011,Biology I,Faculty of Sciences,"[[['Clayton'], ['First semester 2017 (Day)']], [['Malaysia'], ['First semester 2017 (Day)', 'Second semester 2017 (Day)', 'October intake 2017 (Day)']]]",6,0.125,,"BIO1722, BMS1021",2,"A study of animal and plant biology and diversity from genes to whole organisms. The structure and function of plant and animal cells is examined with an emphasis on energy fixation, storage and usage. Principles of genetics, including advances in molecular biology, and current views of evolutionary processes and ecology are integrated into a structured course that offers considerable feedback on progress and opportunities for self paced learning. The subject matter of BIO1011 is continued and expanded in BIO1022 and BIO1042."
BIO1022,Biology II,Faculty of Sciences,"[[['Clayton'], ['Second semester 2017 (Day)']], [['Malaysia'], ['First semester 2017 (Day)', 'Second semester 2017 (Day)']]]",6,0.125,BIO1011,"BIO1711, BMS1021",2,"A study of the biology of whole organisms, organ systems and cells, including molecular genetics, and the effect of environmental parameters on biological functions. The biology of microbes and animals is emphasised. Ecological factors that are biologically important at the level of integrated whole organisms and at cellular, subcellular, and biochemical levels are considered for each organism under study. As for BIO1011 the unit is structured to encourage self paced learning with considerable feed back on individual performance."
BIO1042,Environmental biology,Faculty of Sciences,"[[['Clayton'], ['Second semester 2017 (Day)']]]",6,0.125,,,2,"A study of the biosphere, environmental conditions and their effects on animals, plants and communities; responses of organisms to environmental conditions; interactions between plants and animals; environmental genetics and microbiology; management of biological resources; and an introduction to ecology and the impact of humans on the environment. As for BIO1011 the unit is structured to encourage self-paced learning with considerable feedback on individual performance."
BIO1711,Vertebrate biology,Faculty of Sciences,[],6,0.125,,BIO1022,2,This unit aims to present normal physiological function of the major organ systems in vertebrates. The emphasis is on the study of discrete cell populations and organs within each system and the integration of these systems to meet the needs of the functioning organism. The relationship between structure and function is an underlying theme of the course. Laboratory and tutorial classes are divided into two streams: the human/ medical stream or the animal/ veterinary stream; students select the stream appropriate to their study program and interests.
BIO1722,Cell biology,Faculty of Sciences,[],6,0.125,,"BIO1011, BIO1626",2,"This unit begins with a study of the molecules making up the cell: carbohydrates, lipids, proteins and nucleic acids. This forms the basis for the consideration of cell structure and function. The principles of cellular organisation, cellular metabolism and genetics are introduced. The laboratory program illustrates fundamental aspects of the theory course."
BIO2011,Ecology and biodiversity,Faculty of Sciences,"[[['Clayton'], ['First semester 2017 (Day)']]]",6,0.125," 24 points of level one units, which includes 6 points from BIO units or one of ATS1301, ATS1309, ATS1310, BMS1011 or BMS1021.For Bachelor of Environmental Engineering and associated double degree students only: ENE1621 Environmental engineering and BIO2040 Conservation biology will be required as either prerequisite or corequisite units.",,2,"This unit is an introduction to ecology; the scientific study of the interactions between organisms and their environment. Ecology and biodiversity forms the foundation for understanding conservation and the management of genetics, species and ecosystem diversity. The approach taken is to address core ecological theory, but with an emphasis on contemporary management issues and applications. Topics include the scope and approaches of ecological enquiry; abiotic and biotic factors determining distributions; population growth and regulation; species interactions; patterns and maintenance of biodiversity; food web analysis; disturbance and succession; and production ecology and nutrient cycling. Particular emphasis is placed on integrating ecological processes across spatial and temporal scales. Practical work will be completed via a field excursion together with in-laboratory practical sessions."
BIO2022,Evolutionary ecology,Faculty of Sciences,"[[['Clayton'], ['Second semester 2017 (Day)']]]",6,0.125,BIO1011 and either BIO1022 or BIO1042; or BMS1011 and BMS1021,,2,"This unit introduces students to the patterns and processes of evolution by natural selection. It investigates what species are, how to recognise them, how they are described and classified, and the range of circumstances and mechanisms under which they form in nature. Armed with this background, we investigate the evolution of the key biological phenomena of relevance to ecology, notably life-history evolution. The unit goes on to explore the genetic basis of evolution by natural selection and adaptation of organisms to their environments. This entails an appreciation of the control and inheritance of traits that have major influences in the lives of organisms, and fundamental evolutionary principles and approaches (Hardy-Weinberg equilibrium, fitness, adaptive genetic variation, heritability of complex traits and their response to natural selection). Students will understand how different kinds of genetic variation are (and are not) associated with fitness of individual organisms and viability of populations. We then explore approaches to investigating population biology of organisms (such as estimating dispersal and gene flow in real landscapes) in a coherent progression encompassing small and large ecological scales. These concepts are illustrated by exploration of exciting examples encompassing pure and applied science, including urban ecology, invasion and conservation biology, global change ecology, with associated practical work. We examine fitness in natural populations and the special issues of small populations, particularly inbreeding depression, loss of genetic variation, limits to adaptation to new environmental pressures, and the relationship between genetic variation and extinction risk of populations and species. We investigate how genetic variation in organisms is associated with ecosystem function, ecological community structure and protection against environmental change. The unit ends with an assessment of how evolutionary principles can be applied to try and assist biota to adapt sufficiently rapidly to survive rapidly changing environments with multiple stressors."
