UnitCode,UnitName,Faculty,LocationAndTime,CreditPoints,EFTSL,Preqs,Proh,SCABand,Sypnosis
ESC3887,"Designing urban futures: Urban climate, water and adaptation",Faculty of Sciences,"[[['Clayton'], ['Second semester 2017 (Day)']]]",6,0.125,"ATS2780 or 18 points of Geography, Climate and physical environments or Atmospheric science or permission of the unit co-ordinator","APG4887, ATM3370, ATS3887",2," Urbanisation has profound influences on cities that causes local changes in climate including increased temperature (the Urban Heat Island). Additional impacts include reduced moisture, modified urban waterways, and reduced vegetation. Moreover,urbanisation is linked to hazards such as poor air quality and heat related illnesses. These matters are of particular concern in the context of climate change. This unit will provide an understanding of the relevant physical processes and impacts, along with the associated technological, and socio-political contexts and examine potential solutions by undertaking a sustainable cities approach including the concept of a water sensitive city as an approach to heat mitigation and climate change adaptation. Emphasis is placed on practical, theoretical, observational, analytical and modeling skills developed through lectures, practical's and project work."
ESC3900,Dynamic earth,Faculty of Sciences,"[[['Clayton'], ['Second semester 2017 (Day)']]]",6,0.125,"ESC2111, ESC2122",,2,"The Earth has undergone many fundamental changes since its formation. This unit examines a number of geologically-significant events, including: the formation of the crust, mantle, and core; evolution of the atmosphere and biosphere; supercontinent formation; Snowball Earth; changes to global weathering; and eruption of Large Igneous Provinces. Evidence for these events in the rock record and their impacts on the biosphere and atmosphere will be assessed. The unit will also highlight uncertainties and competing theories that relate to these geological episodes."
ESC4120,Earth sciences research project part time II,Faculty of Sciences,"[[['Clayton'], ['Full year 2017 (Day)', 'Second semester 2017 to First semester 2018 (Day)']]]",18,0.375,,,2,The project fosters independent work and problem-solving abilities. The results of the research project are written up in a thesis and reported in a seminar.
ESC4220,Earth science honours coursework part time II,Faculty of Sciences,"[[['Clayton'], ['Full year 2017 (Day)', 'Second semester 2017 to First semester 2018 (Day)']]]",6,0.125,,,2,Students complete approximately twenty days of coursework on a wide variety of subjects taught at one of the Geoscience departments in the Melbourne area.
FST1800,Fundamentals of food science,Faculty of Sciences,"[[['Malaysia'], ['First semester 2017 (Day)']]]",6,0.125,,,2,"Food science is a highly interdisciplinary applied science. It incorporates concepts from many different fields including microbiology, chemistry, biochemistry and nutrition. This unit provides a comprehensive review of the biological and chemical concepts that are important in food science. Students will be introduced to food composition, food groups and their constituents and the nutritive values of food constituents. Nutrition labelling, food safety, food laws and regulations, quality factors in foods, sensory evaluation and a brief introduction to food processing, packaging and food spoilage and control are included. Regional food culture and current issues in food science, nutrition and technology will also be discussed.  This unit provides an introduction to food science and technology and is a basis for more advanced study."
FST2810,Food bioprocess technology,Faculty of Sciences,"[[['Malaysia'], ['Second semester 2017 (Day)']]]",6,0.125,"Either CHM1022 or CHM1052, and FST1800",BTH2811,2,"In this unit, students will be introduced to typical biochemical processes, from feedstock supply, reaction, separation and utilities. Treatment and storage of the feedstock/product will also be examined. The subject will focus on the operation and choice of typical equipment and processes. Safety issues and financial impact will be highlighted."
FST3800,Food science internship,Faculty of Sciences,"[[['Malaysia'], ['Summer semester A (starts November) 2017 (Day)']]]",6,0.125,At least 96 points,,2,"The internship gives Food Science and Technology students the opportunity to apply their university learning to the work place, providing students with experience in tailoring their academic-based learning to the needs of an industry-based partner, and to network with potential employers. This will prepare students for work or professional practice by integrating theoretical knowledge with practice. Students will learn about the process of applying for employment and good workplace practice. The internship will generally be over the summer break and commence in December. It can be taken any time after the completion of Level Two."
FST3810,Human nutrition,Faculty of Sciences,"[[['Malaysia'], ['Second semester 2017 (Day)']]]",6,0.125,BTH2741,,2,"This unit provides an introduction to the nutritional roles of food nutrients in human health and well-being. The uptake and metabolism of major nutrients in the human body are examined and major health issues that are related to diet and nutrients are discussed. Nutritional guidelines for dietary planning according to various requirements are explained and the nutritional requirements of pregnant and lactating women, infants, children, adolescents, adults and older adults are highlighted. Dietary requirements of individuals to support physical activities are outlined."
FST3820,Food preservation,Faculty of Sciences,"[[['Malaysia'], ['First semester 2017 (Day)']]]",6,0.125,BTH2811 or FST2810; and BTH2830 or MIC2011,,2,"Food preservation deals with the methods of prevention or retardation of microbial, chemical and physical degradation of foods, while maintaining their nutritional quality, flavour and consumer appeal. Students will gain a theoretical and practical understanding of the scientific basis of the various traditional, modern and novel methods of food preservation for distribution and storage. Practical, cost-effective and safe preservation techniques to extend the shelf-life of foods will be discussed."
FST3830,Functional foods,Faculty of Sciences,"[[['Malaysia'], ['Second semester 2017 (Day)']]]",6,0.125,"BIO1022, FST1800 and BTH2741",,2,"Functional foods have emerged in the 21st century as a multi-billion dollar industry. The unit provides an overview of the scientific basis of functional foods throughout the human lifespan. Inter-relationships between the validity and proofing of health claims, legislation, safety and advertising strategies will be examined in the context of preventing or delaying onset of health disorders, and providing health benefits for specific disorders/diseases based on available epidemiological information. The unit will provide students with the opportunity to use this information with a view to developing research opportunities and novel products in the burgeoning global functional food market by linking existing knowledge with recent advances in biotechnology."
FST3840,Food processing,Faculty of Sciences,"[[['Malaysia'], ['Second semester 2017 (Day)']]]",6,0.125,"BTH2811 or FST2810, and CHM2962",,2,"Processed foods are increasingly popular around the world owing to their convenience, extended shelf life, and palatability. This unit introduces students to food processing principles that group physical food processes into basic unit operations such as fluid flow, heat transfer, drying, evaporation, contact equilibrium processes, mechanical separations, size reduction and mixing. After this, the unit expands on various processing techniques that transform raw materials into foods that are safe (chemically and microbiologically), nutritious, convenient and attractive to consumers. Students will gain a theoretical and practical understanding of the techniques used in the processing of various food groups.  Students will be familiar with the physical processes and equipment used in processing of various food groups, and the regulation of food industry products and practices."
FST3850,Food product development,Faculty of Sciences,"[[['Malaysia'], ['Second semester 2017 (Day)']]]",6,0.125,,,2,"Food product development covers the trends and innovation in food markets, product design and development, product quality and management, product sensory evaluation and statistical evaluation, food regulatory compliance, packaging and shelf life, Hazard Analysis and Critical Control Points (HACCP) and Good Manufacturing Practice (GMP). Students will work in small groups to integrate knowledge learned from previous semesters and the current unit for a food product development project which involve the planning, management and assessment of a product from conceptualisation to launch. The product development project will allow students to gain experience in team building, to enhance communication skills, and to solve scientific and technical problems. This unit will also help to prepare students for a position in industry or in postgraduate study."
FST4100,Food science and technology research project,Faculty of Sciences,"[[['Malaysia'], ['Full year 2017 (Day)', 'Second semester 2017 to First semester 2018 (Day)']]]",36,0.750,Completion of the requirements for levels one to three of the Bachelor of Science with Honours,,2,Students will undertake a supervised research project. Students will carry out a research project and present the results of their study in both written and oral form. Information about research projects will be available from the course coordinator towards the end of the preceding semester.
FST4280,Honours coursework in food science and technology,Faculty of Sciences,"[[['Malaysia'], ['Full year 2017 (Day)', 'Second semester 2017 to First semester 2018 (Day)']]]",12,0.250,Completion of the requirements for levels one to three of the Bachelor of Science with Honours,,2,"This unit provides advanced instruction in quantitative methods, thesis writing and current topics to students enrolled in the honours program in food science and technology. Students will gain an understanding of advanced experimental design, data analysis and scientific writing that will assist them in completing their honours thesis. Further classes and coursework relating to current topics in food science and technology will assist students in critical analysis of journal articles, providing further support for their academic development in research science."
GEN2041,Foundations of genetics,Faculty of Sciences,"[[['Clayton'], ['First semester 2017 (Day)']], [['Malaysia'], ['First semester 2017 (Day)']]]",6,0.125, BIO1011 and either BIO1022 or BIO1042.Recommended: MOL2011 or MCB2011 (complementary units),BMS2042,2,"The principles, concepts, organisms and techniques of genetics are covered in this unit. Topics include: patterns of inheritance; structure and organisation of genes, chromosomes and genomes; gene regulation, mutation and gene function; relationship of genotype to phenotype; genetic linkage and gene mapping; chromosome variation and its role in both evolution and human disease. Examples are drawn from a range of organisms, including humans."
GEN2052,Genomics and population genetics,Faculty of Sciences,"[[['Clayton'], ['Second semester 2017 (Day)']], [['Malaysia'], ['Second semester 2017 (Day)']]]",6,0.125,"BIO1011 and one of BIO1022 or BIO1042, plus GEN2041",BMS2042,2,"The structure, function, variation and evolution of DNA and of genomes are examined at both the individual and population levels in a range of organisms, including humans. Topics include: genome structure and approaches to genome analysis; genome projects and bioinformatics; functional and comparative genomics; evolution of gene families and movement of genes from organelle to nuclear genomes; genome variation between individuals and species and its applications in genetics; processes that change the genetic constitution of populations and species during evolution."
GEN3030,"Molecular, cellular and developmental genetics",Faculty of Sciences,"[[['Clayton'], ['Second semester 2017 (Day)']]]",6,0.125,GEN2041 or BMS2042 or MCB2011 or MOL2011,,2,"The ability to monitor and manipulate gene activity in experimental models is critical to advance our understanding of how genes control phenotypes. This unit will explore in depth the latest techniques for studying gene expression and function. This includes assaying and visualizing gene expression and protein subcellular localization in vivo, methods for artificially activating or inhibiting gene activity including generating transgenic organisms and comparative and bioinformatic methods for inferring gene function and evaluation. The application of these techniques will be demonstrated using examples of the study of the function and evolution of function of genes underlying fundamental cellular, developmental and physiological processes such as: differentiation and growth, programmed cell death, cell-cell communication, cell movement, tissue patterning, neuronal signalling and cellular homeostatis and metabolism."
GEN3040,Genomics and its applications,Faculty of Sciences,"[[['Clayton'], ['First semester 2017 (Day)']], [['Malaysia'], ['Second semester 2017 (Day)']]]",6,0.125,GEN2041 or BMS2042 or MCB2011 or MOL2011,,2,"Recent technological advances in DNA analysis now allow the rapid and relatively cheap sequencing of entire genomes of individual organisms. These developments have the potential to revolutionize how we identify genes that control both simple and complex traits. Bioinformatic analysis of genomic data will also be highly influential in shaping our view of how organisms adapt to changes in their environment and how over a longer time-scale, traits such as body size and pattern and physiological and behavioral responses can evolve, leading to the rich diversity of life forms seen today. This unit will explore the use of whole-genome techniques to examine gene regulation, identify the genes controlling both simple and complex traits, determine how individuals and populations adapt to selective pressure and piece together the evolutionary changes that have given rise to complex multicellular life. Such information will increasingly be important in the 21st century for sustainable development of human civilization in concert with a healthy planetary environment. Students will acquire relevant laboratory and computer-based skills including genetic database analysis and bioinformatics, forward genetic approaches and mapping and identification of genes controlling complex quantitative traits."
GEN3051,Medical and forensic genetics,Faculty of Sciences,"[[['Clayton'], ['First semester 2017 (Day)']], [['Malaysia'], ['First semester 2017 (Day)']]]",6,0.125,"GEN2041 or BMS2042,  MCB2011 or MOL2011",,2,"The study of genetics and its applications to medicine and forensic biology including genetic disorders, genetic screening and DNA profiling. Topics include cytogenetics, immunogenetics, genetic counselling and gene therapy. The impact and ethics of recent genetic advances on both the individual and society will be discussed. The unit will focus on current techniques in DNA testing both in medical diagnosis and forensic biology. Practical sessions will involve an analysis of human chromosomes and aspects of genetic counselling."
GEN3062,Evolutionary and ecological genetics,Faculty of Sciences,"[[['Clayton'], ['Second semester 2017 (Day)']]]",6,0.125,GEN2052 or BIO2022 or BMS2042,,2,"Evolutionary processes can be applied to help understand diverse topics such as biodiversity, invasive species, disease, mating systems, among others.  This unit will describe how the four evolutionary forces, mutation, random genetic drift, natural selection and gene flow act within and between populations to cause evolutionary change. It covers quantitative genetic, genomic and experimental approaches to understanding the genetic basis of evolutionary change.  The unit offers a combination of interactive lectures, problem based tutorials and laboratory practicals to explore theoretical concepts of evolution and their role in applied problems of the modern world."
GEN3990,Genetics in action research project,Faculty of Sciences,"[[['Clayton'], ['First semester 2017 (Day)', 'Second semester 2017 (Day)']]]",6,0.125,"Students must have their proposed project and supervisor approved by the unit coordinator prior to enrolment. In addition, students must have at least a distinction average across 24 points of second level units, including a minimum of 12 points from BMS2011, BMS2042, GEN2041, GEN2052, MCB2011, MCB2022, MOL2011, or MOL2022.","SCI3740, SCI3990",2,"This unit provides the opportunity for high-achieving students to undertake an individual research project in Genetics with an academic supervisor. It includes a critical literature review, experimental design and data analysis. The student must maintain regular contact with supervisor(s) and subject coordinator."
GPS4120,Geophysics research project part time II,Faculty of Sciences,"[[['Clayton'], ['Full year 2017 (Day)', 'Second semester 2017 to First semester 2018 (Day)']]]",18,0.375,,,2,The project fosters independent work and problem-solving abilities. The results of the research project are written up in a thesis and reported in a seminar.
GPS4220,Geophysics honours coursework part time II,Faculty of Sciences,"[[['Clayton'], ['Full year 2017 (Day)', 'Second semester 2017 to First semester 2018 (Day)']]]",6,0.125,,,2,Students complete approximately twenty days of coursework on a wide variety of subjects taught at one of the Geoscience departments in the Melbourne area.
HUP3011,Human pathology 1: Understanding disease processes,Faculty of Sciences,"[[['Clayton'], ['First semester 2017 (Day)']]]",6,0.125,"IMM2011, IMM2022, and either MCB2011 or MOL2011; or BMS1062 and BMS2011 and BMS2052",,2,"HUP3011 introduces students to basic pathology, i.e. molecular and cellular mechanisms of disease and how diseases are characterized and progress. Topics include tissue injury and cell death, inflammation, haematopathology, disorders of immunity, disorders of cell growth, neoplasia and pathology of infectious diseases.  Mechanisms for pathological processes are reviewed together with how these processes cause disease by overcoming normal regulatory controls.   Principles are illustrated by reference to specific diseases.  This approach provides students with an understanding of terminologies applicable to pathology and an appreciation of the causes and natural progress of human diseases."
HUP3022,Human pathology 2: Pathology of human diseases,Faculty of Sciences,"[[['Clayton'], ['Second semester 2017 (Day)']]]",6,0.125,"HUP3011, or a combination of MOL2011 or MCB2011 or BMS1062 and one of DEV2022 or BMS2011",,2,"This unit will adopt a systematic approach to the study of pathology. Organ systems will be addressed in turn including the important diseases in each. These will include ischaemic heart disease, diabetes, obesity, stroke, leukaemia, carcinomas of the breast, lung and colon, inflammatory diseases of the lung, kidney and liver, and sexually transmitted diseases. The aetiology, clinical presentation, treatment and course of the diseases will be discussed. Particular emphasis will be placed on molecular and genetic aspects of disease pathogenesis. Laboratory investigations will be presented to provide an integrated approach to the diagnosis of specific diseases."
HUP3810,Principles of pathology 1,Faculty of Sciences,"[[['Malaysia'], ['First semester 2017 (Day)']]]",6,0.125,"BTH2741, BTH2752, and six points of level two Physiology",HUP3801,2,"This unit will introduce students to two aspects of Pathology - Clinical biochemistry and Haematology - and their importance in medical sciences. The content is broad-based and focuses on general principles and pathophysiological processes in the body. The lecture and practical material emphasises applied and practical aspects of the topics. The unit will include the following: Clinical biochemistry includes fluid and electrolyte balance, metabolism of vitamins and minerals and diseases due to deficiencies, the role of plasma enzymes in prognosis and diagnosis and some organ functions and diseases; Haematology - involves the anaemias, leukaemias, myeloproliferative and bleeding disorders together with platelet disorders and coagulation as well as the principles of blood banking and blood transfusion. Haematological and physiological changes in pregnancy and neonatal state will also be included."
HUP3820,Principles of pathology 2,Faculty of Sciences,"[[['Malaysia'], ['Second semester 2017 (Day)']]]",6,0.125,"Six points of level one Biology, ANT1800, BTH2741, and BTH2752",HUP3801,2," This unit will introduce students to various aspects of anatomical pathology (histology and cytology), medical parasitology and entomology, and their importance in medical sciences. The unit focuses on general principles and pathophysiological processes in the human body. The lectures and practical materials emphasize applied and practical aspects of the topics which will include the following:Anatomical pathology and Cytology which include common cytological problems of gynaecological and non gynaecological nature, acute and chronic inflammation, healing and repair, circulatory disorders as well as hyperplasia and neoplasia;Medical Parasitology and Entomology will include protozoology, helminthology and arthropods together with basic knowledge of the life cycles and human diseases borne by insects and arachnids found in the Malaysian region."
HUP3990,Human pathology in action research project,Faculty of Sciences,"[[[], ['First semester 2017 (Day)', 'Second semester 2017 (Day)', 'Summer semester A (starts November) 2017 (Day)']]]",6,0.125, A grade point average of at least 70 in 12 points of study in the discipline area at 3rd year level and a grade point average of at least 70 over 24 points in relevant units at 2nd year level.Students must demonstrate they have an appropriate project and supervisor.Permission for enrolment must be obtained from the Head of School or unit convener.,,2,"This unit provides high achieving students a structured research project in Human pathology supervised by an academic and/or clinical researchers within, or associated with, the Department of Clinical Haematology. The research project is selected from a list of projects available at the beginning of semester from the Department of Clinical Haematology. Students will learn skills in research design, implementation, data analysis and interpretation.  In addition, students will develop skills in scientific communication through written assignments and reports and oral presentations based on their project."
IBL2030,Industry based learning: Science,Faculty of Sciences,"[[['Gippsland'], ['First semester (extended) 2017 (Day)', 'Second semester (extended) 2017 (Day)']]]",12,0.250,"1. Admission to cooperative education program.2. Satisfactory completion of the work placement training sessions and the two work placements of 10 days in Year 1 and 15 days in Year 2.3. Completion of at least 84 points of studies creditable to course, normally consisting of at least seven 6-point units in each of the first two years of studies.",IBL2020,2,"Students undertake discipline-related work in a full time, paid industrial placement of minimum 24 weeks. For admission to the cooperative education program, students participate in a selection process and are short-listed based on academic performance, interpersonal and communication skills and employer requirements. Students negotiate and undertake a learning contract with their workplace and academic supervisors, in response to the requirements of their role, focusing on personal and professional development, understanding their environment at the team, organisation and industry level, and development of scientific skills and knowledge."
IMM2011,Basic immunology: The body's defence system,Faculty of Sciences,"[[['Clayton'], ['First semester 2017 (Day)']]]",6,0.125,BIO1022 or BMS1021 or BMS1062. Recommended: a level one Chemistry unit or VCE Chemistry.,,3,"The immune system is central to many aspects of health such as recovering from viral and bacterial infections, vaccination against common diseases, fighting cancers and accepting organ transplants. The immune system is also responsible for many common conditions such as allergy and autoimmune diseases including type 1 diabetes, multiple sclerosis and rheumatoid arthritis. IMM2011: Basic immunology: The body's defence system, introduces students to the fundamental concepts of the immune system. It describes the structure of the immune system and how it can develop specificity and diversity for combating microbes and pathogens. Key concepts surrounding the function of the immune system in how it communicates and makes decisions when generating specific immune responses will be learnt. IMM2011 is designed to give students a basic but fundamental knowledge of the immune system useful to many areas of biomedical science. It can lead into further studies in second semester (IMM2022) and more advanced studies at level three and beyond. Together with formal lectures and tutorials, practical classes reinforce key concepts that students have been introduced. In addition, flexible learning options including on-line material, audio-taped lectures, quizzes and interactive tutorials provide students with a wide variety of experiences and skill development."
